<?xml version="1.0" encoding="UTF-8"?>
<devices  xmlns:xsi="http://www.w3.org/2001/XMLSchema-instance"
          xmlns="http://www.example.com/devices"
          xsi:schemaLocation="http://www.example.com/devices  DevicesXSD.xsd">

    <device ID = "ID_1" >
        <component>
            <name>Block</name>
            <country>Russia</country>
            <price>2</price>
            <peripheral>true</peripheral>
            <power_Consumption_Watt>2</power_Consumption_Watt>
            <port>COM</port>
            <critical>true</critical>
        </component>
        <component>
            <name>Fffff</name>
            <country>Russia</country>
            <price>2</price>
            <peripheral>true</peripheral>
            <power_Consumption_Watt>2</power_Consumption_Watt>
            <port>COM</port>
            <critical>true</critical>
        </component>
    </device>

</devices>